Valla,Vallado o estacada para defensa
Votar,Dicho de una persona Dar su voto o decir su dictamen en una reunión o cuerpo deliberante o en una elección de personas
Ventoso,Que contiene viento o aire
Vibrar,Dar un movimiento trémulo a la espada o a otra cosa larga delgada y elástica
Volcar,Torcer o inclinar algo parcial o totalmente de modo que caiga generalmente haciendo salir su contenido Volcó la copa Tropezó y la copa se volcó
Vuelta,Movimiento de una cosa alrededor de un punto o girando sobre sí misma hasta invertir su posición primera o hasta recobrarla de nuevo
